StartDate,EndDate,Status,IPAddress,Progress,Duration (in seconds),Finished,RecordedDate,ResponseId,RecipientLastName,RecipientFirstName,RecipientEmail,ExternalReference,LocationLatitude,LocationLongitude,DistributionChannel,UserLanguage,subject_id,caregiver_strategy,child_strategy,open_response
2023-03-09 10:20:34,2023-03-09 10:25:43,IP Address,*******,100,308,True,2023-03-09 10:25:44,R_1gkmaK3DqcjjAKt,*******,*******,*******,*******,*******,*******,anonymous,EN,p072,Sometimes I chose randomly and other times I chose two animals that I knew he liked most and wanted to see which one he would choose.,"I believe he chose either his favorite of the two animals or the one he wanted to hear the name of again just to learn it again.  ","That was a fun way to learn new animal names. "
2023-03-10 08:58:43,2023-03-10 09:00:08,IP Address,*******,100,85,True,2023-03-10 09:00:09,R_1QaXL7MMHuK0vxb,*******,*******,*******,*******,*******,*******,anonymous,EN,p073,"Animals I thought she didn’t know ","Ones they knew ",Nope
2023-03-10 15:24:41,2023-03-10 15:26:42,IP Address,*******,100,120,True,2023-03-10 15:26:42,R_31uXv1bdQFaAN82,*******,*******,*******,*******,*******,*******,anonymous,EN,p074,I tried to pick animals that I thought were unfamiliar to him,"First, animals he was curious about. Then, animals that are his favorite.",
2023-03-13 12:15:34,2023-03-13 12:17:17,IP Address,*******,100,102,True,2023-03-13 12:17:20,R_24HkvHR4sWcgba6,*******,*******,*******,*******,*******,*******,anonymous,EN,p075,I tried to pick one he knew and one he didn’t so he’d be more likely to pick the new animal,Learning the new animal name,
2023-03-14 09:11:46,2023-03-14 09:14:27,IP Address,*******,100,160,True,2023-03-14 09:14:28,R_2rjCPD2ooBlPe9g,*******,*******,*******,*******,*******,*******,anonymous,EN,p067,,,
2023-03-14 09:14:32,2023-03-14 09:15:37,IP Address,*******,100,65,True,2023-03-14 09:15:38,R_3niM1L16TdCjvLP,*******,*******,*******,*******,*******,*******,anonymous,EN,p076,"I picked one he knew and one he didn’t know ","The animals he knew ",
2023-03-15 07:56:45,2023-03-15 07:59:22,IP Address,*******,100,156,True,2023-03-15 07:59:23,R_SPkauXL3FofhXXz,*******,*******,*******,*******,*******,*******,anonymous,EN,p077,I tried to pick animals that were less familiar to her.,She preferred the choice on the right— she was new to the tablet and having trouble reaching across to the far left. She also seemed to prefer familiar or favorite animals.,
